[
  {
    "name": "Acetaminophen",
    "genericName": "Acetaminophen",
    "brandNames": ["Tylenol"],
    "category": "Over-the-counter",
    "rxTermsName": "Acetaminophen",
    "strengthsAndForms": ["325 MG Oral Tablet", "500 MG Oral Tablet", "650 MG Extended Release Oral Tablet"],
    "commonUses": ["for pain", "for fever", "for headache"],
    "foodInstructions": "May be taken with or without food. Take with water.",
    "source": "RxTerms",
    "lastUpdated": "2026-05-20"
  },
  {
    "name": "Amlodipine",
    "genericName": "Amlodipine",
    "brandNames": ["Norvasc"],
    "category": "Prescription",
    "rxTermsName": "Amlodipine",
    "strengthsAndForms": ["2.5 MG Oral Tablet", "5 MG Oral Tablet", "10 MG Oral Tablet"],
    "commonUses": ["for blood pressure", "for chest pain"],
    "foodInstructions": "May be taken with or without food.",
    "source": "RxTerms",
    "lastUpdated": "2026-05-20"
  },
  {
    "name": "Amoxicillin",
    "genericName": "Amoxicillin",
    "brandNames": ["Amoxil"],
    "category": "Prescription",
    "rxTermsName": "Amoxicillin",
    "strengthsAndForms": ["250 MG Oral Capsule", "500 MG Oral Capsule", "875 MG Oral Tablet"],
    "commonUses": ["for infection", "for sinus infection", "for ear infection"],
    "foodInstructions": "May be taken with or without food. Take with food if stomach upset occurs.",
    "source": "RxTerms",
    "lastUpdated": "2026-05-20"
  },
  {
    "name": "Aspirin",
    "genericName": "Aspirin",
    "brandNames": ["Bayer", "Ecotrin"],
    "category": "Over-the-counter",
    "rxTermsName": "Aspirin",
    "strengthsAndForms": ["81 MG Oral Tablet", "325 MG Oral Tablet"],
    "commonUses": ["for heart health", "for pain", "for inflammation"],
    "foodInstructions": "Take with food or a full glass of water unless instructed otherwise.",
    "source": "RxTerms",
    "lastUpdated": "2026-05-20"
  },
  {
    "name": "Atorvastatin",
    "genericName": "Atorvastatin",
    "brandNames": ["Lipitor"],
    "category": "Prescription",
    "rxTermsName": "Atorvastatin",
    "strengthsAndForms": ["10 MG Oral Tablet", "20 MG Oral Tablet", "40 MG Oral Tablet", "80 MG Oral Tablet"],
    "commonUses": ["for cholesterol", "for heart health"],
    "foodInstructions": "May be taken with or without food.",
    "source": "RxTerms",
    "lastUpdated": "2026-05-20"
  },
  {
    "name": "Calcium",
    "genericName": "Calcium",
    "brandNames": [],
    "category": "Supplement",
    "rxTermsName": "Calcium",
    "strengthsAndForms": ["500 MG Oral Tablet", "600 MG Oral Tablet", "1 Oral Tablet"],
    "commonUses": ["for bone health", "for low calcium"],
    "foodInstructions": "Often taken with food. Follow the product label or clinician instructions.",
    "source": "RxTerms",
    "lastUpdated": "2026-05-20"
  },
  {
    "name": "Cetirizine",
    "genericName": "Cetirizine",
    "brandNames": ["Zyrtec"],
    "category": "Over-the-counter",
    "rxTermsName": "Cetirizine",
    "strengthsAndForms": ["5 MG Oral Tablet", "10 MG Oral Tablet", "10 MG Oral Capsule"],
    "commonUses": ["for allergies", "for itching", "for hay fever"],
    "foodInstructions": "May be taken with or without food.",
    "source": "RxTerms",
    "lastUpdated": "2026-05-20"
  },
  {
    "name": "Ferrous Sulfate",
    "genericName": "Ferrous Sulfate",
    "brandNames": [],
    "category": "Supplement",
    "rxTermsName": "Ferrous Sulfate",
    "strengthsAndForms": ["325 MG Oral Tablet", "65 MG Iron Oral Tablet"],
    "commonUses": ["for low iron", "for iron deficiency"],
    "foodInstructions": "Often taken on an empty stomach, but may be taken with food if stomach upset occurs.",
    "source": "RxTerms",
    "lastUpdated": "2026-05-20"
  },
  {
    "name": "Fish Oil",
    "genericName": "Omega-3 Fatty Acids",
    "brandNames": [],
    "category": "Supplement",
    "rxTermsName": "Omega-3 Fatty Acids",
    "strengthsAndForms": ["1000 MG Oral Capsule", "1200 MG Oral Capsule"],
    "commonUses": ["for heart health", "for triglycerides", "for omega-3 support"],
    "foodInstructions": "Take with food to reduce aftertaste or stomach upset.",
    "source": "RxTerms",
    "lastUpdated": "2026-05-20"
  },
  {
    "name": "Ibuprofen",
    "genericName": "Ibuprofen",
    "brandNames": ["Advil", "Motrin"],
    "category": "Over-the-counter",
    "rxTermsName": "Ibuprofen",
    "strengthsAndForms": ["200 MG Oral Tablet", "400 MG Oral Tablet", "200 MG Oral Capsule"],
    "commonUses": ["for pain", "for inflammation", "for fever"],
    "foodInstructions": "Take with food, milk, or water to reduce stomach upset.",
    "source": "RxTerms",
    "lastUpdated": "2026-05-20"
  },
  {
    "name": "Levothyroxine",
    "genericName": "Levothyroxine",
    "brandNames": ["Synthroid", "Levoxyl"],
    "category": "Prescription",
    "rxTermsName": "Levothyroxine",
    "strengthsAndForms": ["25 MCG Oral Tablet", "50 MCG Oral Tablet", "75 MCG Oral Tablet", "100 MCG Oral Tablet"],
    "commonUses": ["for thyroid", "for hypothyroidism"],
    "foodInstructions": "Commonly taken on an empty stomach with water. Follow prescriber instructions.",
    "source": "RxTerms",
    "lastUpdated": "2026-05-20"
  },
  {
    "name": "Lisinopril",
    "genericName": "Lisinopril",
    "brandNames": ["Prinivil", "Zestril"],
    "category": "Prescription",
    "rxTermsName": "Lisinopril",
    "strengthsAndForms": ["5 MG Oral Tablet", "10 MG Oral Tablet", "20 MG Oral Tablet", "40 MG Oral Tablet"],
    "commonUses": ["for blood pressure", "for heart health"],
    "foodInstructions": "May be taken with or without food. Take with water.",
    "source": "RxTerms",
    "lastUpdated": "2026-05-20"
  },
  {
    "name": "Loratadine",
    "genericName": "Loratadine",
    "brandNames": ["Claritin"],
    "category": "Over-the-counter",
    "rxTermsName": "Loratadine",
    "strengthsAndForms": ["10 MG Oral Tablet", "10 MG Disintegrating Oral Tablet", "5 MG Chewable Tablet"],
    "commonUses": ["for allergies", "for hay fever"],
    "foodInstructions": "May be taken with or without food.",
    "source": "RxTerms",
    "lastUpdated": "2026-05-20"
  },
  {
    "name": "Magnesium",
    "genericName": "Magnesium",
    "brandNames": [],
    "category": "Supplement",
    "rxTermsName": "Magnesium",
    "strengthsAndForms": ["200 MG Oral Tablet", "250 MG Oral Tablet", "400 MG Oral Tablet"],
    "commonUses": ["for low magnesium", "for muscle cramps", "for magnesium support"],
    "foodInstructions": "Take with food if stomach upset occurs.",
    "source": "RxTerms",
    "lastUpdated": "2026-05-20"
  },
  {
    "name": "Melatonin",
    "genericName": "Melatonin",
    "brandNames": [],
    "category": "Supplement",
    "rxTermsName": "Melatonin",
    "strengthsAndForms": ["1 MG Oral Tablet", "3 MG Oral Tablet", "5 MG Oral Tablet", "10 MG Oral Tablet"],
    "commonUses": ["for sleep", "for jet lag"],
    "foodInstructions": "May be taken with or without food.",
    "source": "RxTerms",
    "lastUpdated": "2026-05-20"
  },
  {
    "name": "Metformin",
    "genericName": "Metformin",
    "brandNames": ["Glucophage"],
    "category": "Prescription",
    "rxTermsName": "Metformin",
    "strengthsAndForms": ["500 MG Oral Tablet", "850 MG Oral Tablet", "1000 MG Oral Tablet", "500 MG Extended Release Oral Tablet"],
    "commonUses": ["for blood sugar", "for diabetes"],
    "foodInstructions": "Commonly taken with meals to reduce stomach upset.",
    "source": "RxTerms",
    "lastUpdated": "2026-05-20"
  },
  {
    "name": "Multivitamin",
    "genericName": "Multivitamin",
    "brandNames": [],
    "category": "Vitamin",
    "rxTermsName": "Multivitamin",
    "strengthsAndForms": ["1 Oral Tablet", "1 Oral Capsule", "1 Chewable Tablet"],
    "commonUses": ["for daily vitamin support", "for nutrition support"],
    "foodInstructions": "Take with food unless the product label says otherwise.",
    "source": "RxTerms",
    "lastUpdated": "2026-05-20"
  },
  {
    "name": "Omeprazole",
    "genericName": "Omeprazole",
    "brandNames": ["Prilosec"],
    "category": "Over-the-counter",
    "rxTermsName": "Omeprazole",
    "strengthsAndForms": ["10 MG Delayed Release Oral Capsule", "20 MG Delayed Release Oral Capsule", "40 MG Delayed Release Oral Capsule"],
    "commonUses": ["for acid reflux", "for heartburn", "for stomach acid"],
    "foodInstructions": "Often taken before a meal. Follow the product label or prescriber instructions.",
    "source": "RxTerms",
    "lastUpdated": "2026-05-20"
  },
  {
    "name": "Probiotic",
    "genericName": "Probiotic",
    "brandNames": [],
    "category": "Supplement",
    "rxTermsName": "Probiotic",
    "strengthsAndForms": ["1 Oral Capsule", "1 Oral Tablet", "1 Packet"],
    "commonUses": ["for gut health", "for digestive support"],
    "foodInstructions": "Follow the product label. Some probiotics are taken with food.",
    "source": "Local",
    "lastUpdated": "2026-05-20"
  },
  {
    "name": "Vitamin B12",
    "genericName": "Cyanocobalamin",
    "brandNames": [],
    "category": "Vitamin",
    "rxTermsName": "Cyanocobalamin",
    "strengthsAndForms": ["500 MCG Oral Tablet", "1000 MCG Oral Tablet"],
    "commonUses": ["for low B12", "for energy support"],
    "foodInstructions": "May be taken with or without food.",
    "source": "RxTerms",
    "lastUpdated": "2026-05-20"
  },
  {
    "name": "Vitamin C",
    "genericName": "Ascorbic Acid",
    "brandNames": [],
    "category": "Vitamin",
    "rxTermsName": "Ascorbic Acid",
    "strengthsAndForms": ["250 MG Oral Tablet", "500 MG Oral Tablet", "1000 MG Oral Tablet"],
    "commonUses": ["for vitamin C support", "for immune support"],
    "foodInstructions": "May be taken with food if stomach upset occurs.",
    "source": "RxTerms",
    "lastUpdated": "2026-05-20"
  },
  {
    "name": "Vitamin D3",
    "genericName": "Cholecalciferol",
    "brandNames": [],
    "category": "Vitamin",
    "rxTermsName": "Cholecalciferol",